{
  "schemaVersion": 1,
  "eventType": "CartonDetected",
  "eventId": "6ca03007-d7b1-5163-8595-e5d8349a78e8",
  "correlationId": "6ca03007-d7b1-5163-8595-e5d8349a78e8",
  "occurredAt": "2026-10-12T18:04:11.204Z",
  "siteId": "PLANT-01",
  "stationId": "LINE-01",
  "plcEpoch": 42,
  "cycleId": "918273",
  "idempotencyKey": "PLANT-01:LINE-01:42:918273",
  "detectionOrigin": "OBSERVED",
  "transport": "SUBSCRIPTION",
  "queueOverflow": false,
  "detectionTimestamp": "2026-10-12T18:04:11.204Z",
  "receivedAt": "2026-10-12T18:04:11.221Z",
  "deadlineReference": "PLC_TIMESTAMP",
  "deadlineAt": "2026-10-12T18:04:12.254Z",
  "configRevision": 7,
  "workOrderId": "WO-2026-4815",
  "sourceFingerprint": "57d6ff68618411b327c4a5209af69e4f5802bb4a6282ed7946569cd16f893b3c",
  "opc": {
    "nodeId": "ns=2;s=LINE-01.CartonCycleRecord",
    "statusCode": "Good",
    "sourceTimestamp": "2026-10-12T18:04:11.204Z"
  }
}
